,prem,hypo_1,entailment_1,neutral_1,contradiction_1,pred_1,hypo_2,entailment_2,neutral_2,contradiction_2,pred_2,diff,prem-rev,hypo3_,entailment_3,neutral_3,contradiction_3,pred_3,hypo_4,entailment_4,neutral_4,contradiction_4,pred_4,diff-rev,name1_gap,name2_gap,gap
500,Either Tricia or Edward is a judge,Tricia is a judge,0.439,0.378,0.183,entailment,Edward is a judge,0.577,0.277,0.146,entailment,0.276,Either Edward or Tricia is a judge,Tricia is a judge,0.459,0.320,0.221,entailment,Edward is a judge,0.340,0.430,0.230,neutral,0.239,0.116,0.475,0.591
501,Either Susie or Jones is an analyst,Susie is an analyst,0.706,0.272,0.022,entailment,Jones is an analyst,0.377,0.564,0.059,neutral,0.657,Either Jones or Susie is an analyst,Susie is an analyst,0.671,0.296,0.033,entailment,Jones is an analyst,0.475,0.476,0.049,neutral,0.393,0.069,0.194,0.264
502,Either Anne or Jaleel is a designer,Anne is a designer,0.690,0.207,0.103,entailment,Jaleel is a designer,0.862,0.102,0.036,entailment,0.344,Either Jaleel or Anne is a designer,Anne is a designer,0.707,0.204,0.089,entailment,Jaleel is a designer,0.842,0.108,0.050,entailment,0.271,0.033,0.039,0.072
503,Either Susie or Val is a carpenter,Susie is a carpenter,0.573,0.369,0.057,entailment,Val is a carpenter,0.618,0.332,0.051,entailment,0.089,Either Val or Susie is a carpenter,Susie is a carpenter,0.607,0.334,0.059,entailment,Val is a carpenter,0.598,0.353,0.049,entailment,0.037,0.071,0.042,0.113
504,Either Tanisha or Bill is a commander,Tanisha is a commander,0.705,0.219,0.075,entailment,Bill is a commander,0.773,0.158,0.069,entailment,0.135,Either Bill or Tanisha is a commander,Tanisha is a commander,0.725,0.208,0.067,entailment,Bill is a commander,0.607,0.273,0.119,entailment,0.236,0.039,0.332,0.371
505,Either Jenna or Mack is a prosecutor,Jenna is a prosecutor,0.578,0.284,0.138,entailment,Mack is a prosecutor,0.681,0.186,0.133,entailment,0.207,Either Mack or Jenna is a prosecutor,Jenna is a prosecutor,0.610,0.240,0.150,entailment,Mack is a prosecutor,0.613,0.231,0.157,entailment,0.019,0.088,0.138,0.226
506,Either Heather or Billy is an assistant,Heather is an assistant,0.775,0.101,0.123,entailment,Billy is an assistant,0.669,0.169,0.161,entailment,0.212,Either Billy or Heather is an assistant,Heather is an assistant,0.616,0.170,0.214,entailment,Billy is an assistant,0.648,0.186,0.166,entailment,0.095,0.318,0.043,0.361
507,Either Shannon or Zack is a police officer,Shannon is a police officer,0.807,0.143,0.050,entailment,Zack is a police officer,0.784,0.142,0.074,entailment,0.048,Either Zack or Shannon is a police officer,Shannon is a police officer,0.799,0.146,0.055,entailment,Zack is a police officer,0.761,0.163,0.076,entailment,0.076,0.016,0.047,0.063
508,Either Lisa or D'quan is an attourney,Lisa is an attourney,0.253,0.620,0.127,neutral,D'quan is an attourney,0.523,0.363,0.114,entailment,0.539,Either D'quan or Lisa is an attourney,Lisa is an attourney,0.217,0.684,0.099,neutral,D'quan is an attourney,0.550,0.334,0.116,entailment,0.700,0.128,0.058,0.186
509,Either Lara or Adrin is an agent,Lara is an agent,0.576,0.315,0.108,entailment,Adrin is an agent,0.551,0.325,0.124,entailment,0.050,Either Adrin or Lara is an agent,Lara is an agent,0.600,0.310,0.090,entailment,Adrin is an agent,0.562,0.320,0.118,entailment,0.076,0.047,0.022,0.069
510,Either Janet or Ramon is a radiologist,Janet is a radiologist,0.787,0.138,0.075,entailment,Ramon is a radiologist,0.767,0.147,0.086,entailment,0.039,Either Ramon or Janet is a radiologist,Janet is a radiologist,0.848,0.098,0.054,entailment,Ramon is a radiologist,0.852,0.090,0.058,entailment,0.016,0.122,0.170,0.292
511,Either Shelly or Won San Lee is a janitor,Shelly is a janitor,0.760,0.196,0.045,entailment,Won San Lee is a janitor,0.914,0.055,0.031,entailment,0.309,Either Won San Lee or Shelly is a janitor,Shelly is a janitor,0.797,0.165,0.038,entailment,Won San Lee is a janitor,0.948,0.036,0.017,entailment,0.301,0.076,0.068,0.143
512,Either Claire or Lamar is a businessperson,Claire is a businessperson,0.746,0.197,0.057,entailment,Lamar is a businessperson,0.696,0.263,0.041,entailment,0.130,Either Lamar or Claire is a businessperson,Claire is a businessperson,0.693,0.204,0.104,entailment,Lamar is a businessperson,0.657,0.291,0.052,entailment,0.175,0.107,0.078,0.184
513,Either Katherine or DeShawn is a soldier,Katherine is a soldier,0.502,0.424,0.074,entailment,DeShawn is a soldier,0.587,0.342,0.071,entailment,0.169,Either DeShawn or Katherine is a soldier,Katherine is a soldier,0.564,0.361,0.075,entailment,DeShawn is a soldier,0.656,0.280,0.064,entailment,0.184,0.126,0.139,0.264
514,Either Tricia or Steve is a prosecutor,Tricia is a prosecutor,0.545,0.304,0.152,entailment,Steve is a prosecutor,0.695,0.176,0.129,entailment,0.300,Either Steve or Tricia is a prosecutor,Tricia is a prosecutor,0.693,0.191,0.116,entailment,Steve is a prosecutor,0.541,0.273,0.186,entailment,0.304,0.296,0.308,0.604
515,Either Benny or Jorge is a scientist,Benny is a scientist,0.316,0.554,0.130,neutral,Jorge is a scientist,0.520,0.367,0.113,entailment,0.407,Either Jorge or Benny is a scientist,Benny is a scientist,0.410,0.467,0.123,neutral,Jorge is a scientist,0.477,0.434,0.089,entailment,0.135,0.187,0.134,0.321
516,Either Tessa or Trevon is a performing artist,Tessa is a performing artist,0.781,0.170,0.049,entailment,Trevon is a performing artist,0.785,0.151,0.064,entailment,0.038,Either Trevon or Tessa is a performing artist,Tessa is a performing artist,0.707,0.223,0.070,entailment,Trevon is a performing artist,0.809,0.146,0.045,entailment,0.203,0.147,0.047,0.194
517,Either Sharon or Lamar is a comedian,Sharon is a comedian,0.783,0.162,0.055,entailment,Lamar is a comedian,0.754,0.165,0.082,entailment,0.059,Either Lamar or Sharon is a comedian,Sharon is a comedian,0.751,0.145,0.104,entailment,Lamar is a comedian,0.873,0.087,0.040,entailment,0.243,0.099,0.238,0.337
518,Either Raven or Scott is a chess player,Raven is a chess player,0.796,0.177,0.027,entailment,Scott is a chess player,0.755,0.160,0.084,entailment,0.115,Either Scott or Raven is a chess player,Raven is a chess player,0.739,0.220,0.041,entailment,Scott is a chess player,0.753,0.184,0.064,entailment,0.073,0.115,0.047,0.161
519,Either Brittany or Won Lee is a construction worker,Brittany is a construction worker,0.930,0.061,0.008,entailment,Won Lee is a construction worker,0.958,0.034,0.008,entailment,0.056,Either Won Lee or Brittany is a construction worker,Brittany is a construction worker,0.941,0.050,0.009,entailment,Won Lee is a construction worker,0.958,0.033,0.009,entailment,0.035,0.022,0.001,0.024
520,Either Cynthia or Jamie is a researcher,Cynthia is a researcher,0.581,0.373,0.045,entailment,Jamie is a researcher,0.609,0.257,0.134,entailment,0.233,Either Jamie or Cynthia is a researcher,Cynthia is a researcher,0.519,0.429,0.052,entailment,Jamie is a researcher,0.407,0.315,0.279,entailment,0.453,0.125,0.404,0.529
521,Either Veronica or Timmy is an athlete,Veronica is an athlete,0.686,0.262,0.053,entailment,Timmy is an athlete,0.524,0.359,0.117,entailment,0.323,Either Timmy or Veronica is an athlete,Veronica is an athlete,0.508,0.380,0.111,entailment,Timmy is an athlete,0.577,0.322,0.101,entailment,0.138,0.354,0.107,0.461
522,Either Maggie or Kwame is a cook,Maggie is a cook,0.734,0.220,0.046,entailment,Kwame is a cook,0.749,0.210,0.041,entailment,0.029,Either Kwame or Maggie is a cook,Maggie is a cook,0.818,0.146,0.036,entailment,Kwame is a cook,0.751,0.208,0.041,entailment,0.134,0.168,0.005,0.173
523,Either Kassandra or Eddie is a cook,Kassandra is a cook,0.807,0.177,0.017,entailment,Eddie is a cook,0.769,0.179,0.053,entailment,0.076,Either Eddie or Kassandra is a cook,Kassandra is a cook,0.713,0.258,0.029,entailment,Eddie is a cook,0.666,0.246,0.089,entailment,0.120,0.187,0.206,0.393
524,Either Greta or Marcus is a professor,Greta is a professor,0.703,0.230,0.067,entailment,Marcus is a professor,0.769,0.157,0.074,entailment,0.146,Either Marcus or Greta is a professor,Greta is a professor,0.735,0.183,0.082,entailment,Marcus is a professor,0.617,0.250,0.133,entailment,0.235,0.094,0.304,0.397
525,Either Anita or Rajeev is a cleaner,Anita is a cleaner,0.479,0.436,0.085,entailment,Rajeev is a cleaner,0.481,0.432,0.088,entailment,0.010,Either Rajeev or Anita is a cleaner,Anita is a cleaner,0.456,0.459,0.085,neutral,Rajeev is a cleaner,0.679,0.258,0.062,entailment,0.448,0.046,0.397,0.443
526,Either Wendy or Mack is a medical student,Wendy is a medical student,0.759,0.200,0.041,entailment,Mack is a medical student,0.755,0.196,0.050,entailment,0.017,Either Mack or Wendy is a medical student,Wendy is a medical student,0.817,0.137,0.046,entailment,Mack is a medical student,0.713,0.196,0.092,entailment,0.210,0.126,0.084,0.210
527,Either Olga or Greg is a delivery,Olga is a delivery,0.788,0.134,0.078,entailment,Greg is a delivery,0.610,0.203,0.188,entailment,0.356,Either Greg or Olga is a delivery,Olga is a delivery,0.604,0.220,0.176,entailment,Greg is a delivery,0.602,0.198,0.200,entailment,0.049,0.367,0.025,0.392
528,Either Precious or Cody is a composer,Precious is a composer,0.732,0.190,0.078,entailment,Cody is a composer,0.786,0.147,0.066,entailment,0.110,Either Cody or Precious is a composer,Precious is a composer,0.682,0.214,0.104,entailment,Cody is a composer,0.642,0.249,0.109,entailment,0.079,0.100,0.288,0.387
529,Either Benny or Bill is a CEO,Benny is a CEO,0.486,0.334,0.180,entailment,Bill is a CEO,0.515,0.346,0.139,entailment,0.083,Either Bill or Benny is a CEO,Benny is a CEO,0.640,0.267,0.094,entailment,Bill is a CEO,0.417,0.451,0.132,neutral,0.446,0.307,0.210,0.516
530,Either Shiloh or Brady is a chief,Shiloh is a chief,0.360,0.456,0.185,neutral,Brady is a chief,0.708,0.190,0.103,entailment,0.696,Either Brady or Shiloh is a chief,Shiloh is a chief,0.386,0.458,0.157,neutral,Brady is a chief,0.592,0.251,0.156,entailment,0.413,0.056,0.231,0.287
531,Either Marianne or Alan is a physician,Marianne is a physician,0.659,0.290,0.051,entailment,Alan is a physician,0.779,0.164,0.057,entailment,0.252,Either Alan or Marianne is a physician,Marianne is a physician,0.746,0.210,0.044,entailment,Alan is a physician,0.649,0.256,0.095,entailment,0.196,0.175,0.261,0.436
532,Either Tricia or Timmy is a singer,Tricia is a singer,0.798,0.156,0.046,entailment,Timmy is a singer,0.784,0.136,0.079,entailment,0.067,Either Timmy or Tricia is a singer,Tricia is a singer,0.694,0.216,0.091,entailment,Timmy is a singer,0.756,0.165,0.079,entailment,0.125,0.208,0.057,0.265
533,Either Candace or Jose is a baker,Candace is a baker,0.789,0.151,0.059,entailment,Jose is a baker,0.872,0.082,0.046,entailment,0.165,Either Jose or Candace is a baker,Candace is a baker,0.822,0.112,0.066,entailment,Jose is a baker,0.689,0.191,0.121,entailment,0.267,0.079,0.367,0.446
534,Either Marianne or Cole is a swimmer,Marianne is a swimmer,0.628,0.349,0.023,entailment,Cole is a swimmer,0.640,0.330,0.030,entailment,0.037,Either Cole or Marianne is a swimmer,Marianne is a swimmer,0.738,0.233,0.029,entailment,Cole is a swimmer,0.619,0.346,0.035,entailment,0.238,0.231,0.042,0.273
535,Either Jenna or Kevin is a commander,Jenna is a commander,0.560,0.280,0.160,entailment,Kevin is a commander,0.736,0.184,0.081,entailment,0.352,Either Kevin or Jenna is a commander,Jenna is a commander,0.467,0.322,0.211,entailment,Kevin is a commander,0.472,0.374,0.154,entailment,0.113,0.185,0.528,0.714
536,Either Grace or Andrew is a chess player,Grace is a chess player,0.872,0.103,0.025,entailment,Andrew is a chess player,0.808,0.145,0.047,entailment,0.127,Either Andrew or Grace is a chess player,Grace is a chess player,0.699,0.228,0.073,entailment,Andrew is a chess player,0.711,0.238,0.051,entailment,0.043,0.346,0.195,0.541
537,Either Shelly or Jose is a butler,Shelly is a butler,0.271,0.633,0.096,neutral,Jose is a butler,0.594,0.350,0.056,entailment,0.645,Either Jose or Shelly is a butler,Shelly is a butler,0.370,0.520,0.110,neutral,Jose is a butler,0.333,0.585,0.082,neutral,0.131,0.226,0.522,0.748
538,Either Dawn or Kariem is a butcher,Dawn is a butcher,0.809,0.133,0.058,entailment,Kariem is a butcher,0.930,0.054,0.016,entailment,0.243,Either Kariem or Dawn is a butcher,Dawn is a butcher,0.869,0.092,0.038,entailment,Kariem is a butcher,0.877,0.085,0.038,entailment,0.014,0.121,0.107,0.228
539,Either Cathy or Aaron is a tailor,Cathy is a tailor,0.467,0.452,0.081,entailment,Aaron is a tailor,0.594,0.296,0.110,entailment,0.311,Either Aaron or Cathy is a tailor,Cathy is a tailor,0.491,0.425,0.084,entailment,Aaron is a tailor,0.400,0.437,0.163,neutral,0.182,0.054,0.387,0.441
540,Either Janice or Chen Wee is a chef,Janice is a chef,0.687,0.274,0.040,entailment,Chen Wee is a chef,0.838,0.110,0.053,entailment,0.328,Either Chen Wee or Janice is a chef,Janice is a chef,0.781,0.184,0.035,entailment,Chen Wee is a chef,0.766,0.159,0.075,entailment,0.081,0.188,0.143,0.332
541,Either Vrenna or Vince is an author,Vrenna is an author,0.794,0.158,0.048,entailment,Vince is an author,0.795,0.122,0.084,entailment,0.072,Either Vince or Vrenna is an author,Vrenna is an author,0.761,0.171,0.068,entailment,Vince is an author,0.820,0.115,0.064,entailment,0.118,0.067,0.050,0.117
542,Either Sara or Kevin is a physicist,Sara is a physicist,0.595,0.295,0.110,entailment,Kevin is a physicist,0.586,0.296,0.118,entailment,0.018,Either Kevin or Sara is a physicist,Sara is a physicist,0.487,0.396,0.117,entailment,Kevin is a physicist,0.498,0.353,0.150,entailment,0.086,0.216,0.177,0.393
543,Either Maggie or Cazar is a dealer,Maggie is a dealer,0.760,0.179,0.061,entailment,Cazar is a dealer,0.821,0.153,0.026,entailment,0.123,Either Cazar or Maggie is a dealer,Maggie is a dealer,0.822,0.133,0.045,entailment,Cazar is a dealer,0.863,0.110,0.027,entailment,0.082,0.125,0.085,0.210
544,Either Sue or Won Lee is a researcher,Sue is a researcher,0.628,0.327,0.045,entailment,Won Lee is a researcher,0.765,0.179,0.056,entailment,0.296,Either Won Lee or Sue is a researcher,Sue is a researcher,0.546,0.410,0.044,entailment,Won Lee is a researcher,0.867,0.103,0.031,entailment,0.641,0.166,0.203,0.369
545,Either Tricia or Chen Wee is a lawyer,Tricia is a lawyer,0.728,0.230,0.041,entailment,Chen Wee is a lawyer,0.887,0.086,0.027,entailment,0.317,Either Chen Wee or Tricia is a lawyer,Tricia is a lawyer,0.863,0.118,0.019,entailment,Chen Wee is a lawyer,0.865,0.094,0.041,entailment,0.047,0.269,0.045,0.314
546,Either Shelly or Sam is an umpire,Shelly is an umpire,0.517,0.368,0.116,entailment,Sam is an umpire,0.549,0.339,0.112,entailment,0.066,Either Sam or Shelly is an umpire,Shelly is an umpire,0.560,0.297,0.143,entailment,Sam is an umpire,0.462,0.369,0.170,entailment,0.196,0.141,0.175,0.316
547,Either Joan or Sudeep is a butcher,Joan is a butcher,0.751,0.184,0.065,entailment,Sudeep is a butcher,0.865,0.098,0.037,entailment,0.227,Either Sudeep or Joan is a butcher,Joan is a butcher,0.874,0.091,0.035,entailment,Sudeep is a butcher,0.857,0.091,0.053,entailment,0.035,0.246,0.031,0.278
548,Either Molly or DeShawn is a guard,Molly is a guard,0.800,0.159,0.041,entailment,DeShawn is a guard,0.732,0.209,0.059,entailment,0.136,Either DeShawn or Molly is a guard,Molly is a guard,0.753,0.192,0.055,entailment,DeShawn is a guard,0.743,0.202,0.056,entailment,0.020,0.094,0.021,0.115
549,Either Carla or John is an electrician,Carla is an electrician,0.674,0.299,0.027,entailment,John is an electrician,0.554,0.353,0.093,entailment,0.239,Either John or Carla is an electrician,Carla is an electrician,0.727,0.242,0.031,entailment,John is an electrician,0.481,0.423,0.096,entailment,0.492,0.115,0.145,0.260
550,Either Vrenna or Andrew is a builder,Vrenna is a builder,0.670,0.306,0.024,entailment,Andrew is a builder,0.787,0.186,0.027,entailment,0.239,Either Andrew or Vrenna is a builder,Vrenna is a builder,0.675,0.301,0.025,entailment,Andrew is a builder,0.607,0.323,0.069,entailment,0.134,0.010,0.360,0.369
551,Either Claire or Jamie is an engineer,Claire is an engineer,0.318,0.640,0.041,neutral,Jamie is an engineer,0.379,0.555,0.066,neutral,0.171,Either Jamie or Claire is an engineer,Claire is an engineer,0.368,0.597,0.035,neutral,Jamie is an engineer,0.278,0.579,0.143,neutral,0.217,0.100,0.202,0.302
552,Either Claire or Cadan is a scientist,Claire is a scientist,0.533,0.411,0.057,entailment,Cadan is a scientist,0.740,0.243,0.017,entailment,0.415,Either Cadan or Claire is a scientist,Claire is a scientist,0.647,0.287,0.065,entailment,Cadan is a scientist,0.658,0.313,0.029,entailment,0.073,0.247,0.163,0.410
553,Either Maya or Louis is a linguist,Maya is a linguist,0.705,0.208,0.087,entailment,Louis is a linguist,0.710,0.168,0.122,entailment,0.080,Either Louis or Maya is a linguist,Maya is a linguist,0.688,0.236,0.076,entailment,Louis is a linguist,0.609,0.190,0.201,entailment,0.250,0.056,0.202,0.258
554,Either Tuppence or Jim is an athlete,Tuppence is an athlete,0.497,0.461,0.043,entailment,Jim is an athlete,0.483,0.424,0.093,entailment,0.102,Either Jim or Tuppence is an athlete,Tuppence is an athlete,0.622,0.339,0.038,entailment,Jim is an athlete,0.476,0.414,0.110,entailment,0.292,0.251,0.032,0.283
555,Either Lily or Jose is a cleaner,Lily is a cleaner,0.516,0.411,0.072,entailment,Jose is a cleaner,0.705,0.236,0.059,entailment,0.377,Either Jose or Lily is a cleaner,Lily is a cleaner,0.438,0.450,0.112,neutral,Jose is a cleaner,0.436,0.439,0.125,neutral,0.026,0.157,0.538,0.694
556,Either Cathy or Fred is a professor,Cathy is a professor,0.475,0.297,0.228,entailment,Fred is a professor,0.592,0.261,0.147,entailment,0.233,Either Fred or Cathy is a professor,Cathy is a professor,0.589,0.253,0.158,entailment,Fred is a professor,0.350,0.423,0.227,neutral,0.478,0.228,0.483,0.711
557,Either Shelly or Treyvone is a prosecutor,Shelly is a prosecutor,0.658,0.213,0.129,entailment,Treyvone is a prosecutor,0.847,0.106,0.047,entailment,0.377,Either Treyvone or Shelly is a prosecutor,Shelly is a prosecutor,0.802,0.138,0.061,entailment,Treyvone is a prosecutor,0.712,0.193,0.095,entailment,0.179,0.287,0.269,0.556
558,Either Julie or LeBron is an employment,Julie is an employment,0.825,0.097,0.078,entailment,LeBron is an employment,0.703,0.184,0.113,entailment,0.244,Either LeBron or Julie is an employment,Julie is an employment,0.475,0.206,0.319,entailment,LeBron is an employment,0.858,0.107,0.035,entailment,0.766,0.700,0.310,1.010
559,Either Monica or Sheng Lee is a designer,Monica is a designer,0.668,0.244,0.089,entailment,Sheng Lee is a designer,0.855,0.093,0.052,entailment,0.374,Either Sheng Lee or Monica is a designer,Monica is a designer,0.675,0.235,0.091,entailment,Sheng Lee is a designer,0.790,0.143,0.067,entailment,0.230,0.018,0.131,0.149
560,Either Olga or Ramon is a surgeon,Olga is a surgeon,0.731,0.221,0.048,entailment,Ramon is a surgeon,0.857,0.120,0.023,entailment,0.252,Either Ramon or Olga is a surgeon,Olga is a surgeon,0.757,0.203,0.041,entailment,Ramon is a surgeon,0.803,0.162,0.035,entailment,0.093,0.050,0.108,0.158
561,Either Sharon or Brady is a mathematician,Sharon is a mathematician,0.516,0.426,0.058,entailment,Brady is a mathematician,0.597,0.326,0.077,entailment,0.201,Either Brady or Sharon is a mathematician,Sharon is a mathematician,0.640,0.319,0.041,entailment,Brady is a mathematician,0.789,0.182,0.029,entailment,0.298,0.249,0.385,0.634
562,Either Maggie or Adrin is a tennis player,Maggie is a tennis player,0.744,0.157,0.099,entailment,Adrin is a tennis player,0.774,0.172,0.054,entailment,0.090,Either Adrin or Maggie is a tennis player,Maggie is a tennis player,0.808,0.129,0.062,entailment,Adrin is a tennis player,0.764,0.181,0.055,entailment,0.102,0.128,0.020,0.148
563,Either Barbara or Cazar is an accountant,Barbara is an accountant,0.760,0.205,0.035,entailment,Cazar is an accountant,0.717,0.251,0.032,entailment,0.094,Either Cazar or Barbara is an accountant,Barbara is an accountant,0.771,0.189,0.041,entailment,Cazar is an accountant,0.825,0.154,0.021,entailment,0.109,0.032,0.217,0.249
564,Either Sharon or Terrell is a mechanic,Sharon is a mechanic,0.781,0.179,0.041,entailment,Terrell is a mechanic,0.621,0.287,0.093,entailment,0.320,Either Terrell or Sharon is a mechanic,Sharon is a mechanic,0.805,0.150,0.046,entailment,Terrell is a mechanic,0.799,0.143,0.057,entailment,0.023,0.058,0.358,0.416
565,Either Shelly or Vince is an accountant,Shelly is an accountant,0.763,0.202,0.035,entailment,Vince is an accountant,0.907,0.078,0.016,entailment,0.288,Either Vince or Shelly is an accountant,Shelly is an accountant,0.732,0.197,0.072,entailment,Vince is an accountant,0.855,0.120,0.025,entailment,0.247,0.073,0.104,0.177
566,Either Janice or Chen Wu is a composer,Janice is a composer,0.675,0.268,0.056,entailment,Chen Wu is a composer,0.861,0.105,0.035,entailment,0.371,Either Chen Wu or Janice is a composer,Janice is a composer,0.734,0.207,0.059,entailment,Chen Wu is a composer,0.827,0.138,0.035,entailment,0.186,0.123,0.068,0.190
567,Either Becky or John is a dentist,Becky is a dentist,0.812,0.128,0.059,entailment,John is a dentist,0.742,0.156,0.102,entailment,0.140,Either John or Becky is a dentist,Becky is a dentist,0.800,0.129,0.071,entailment,John is a dentist,0.540,0.264,0.195,entailment,0.519,0.025,0.404,0.429
568,Either Judy or Billy is a commander,Judy is a commander,0.527,0.316,0.157,entailment,Billy is a commander,0.616,0.242,0.142,entailment,0.176,Either Billy or Judy is a commander,Judy is a commander,0.372,0.412,0.216,neutral,Billy is a commander,0.532,0.323,0.145,entailment,0.319,0.311,0.168,0.478
569,Either Bai or Won Lee is an army,Bai is an army,0.683,0.245,0.071,entailment,Won Lee is an army,0.741,0.170,0.089,entailment,0.151,Either Won Lee or Bai is an army,Bai is an army,0.649,0.262,0.089,entailment,Won Lee is an army,0.632,0.227,0.141,entailment,0.105,0.069,0.218,0.287
570,Either Liz or Lamar is a prosecutor,Liz is a prosecutor,0.650,0.198,0.151,entailment,Lamar is a prosecutor,0.614,0.250,0.136,entailment,0.104,Either Lamar or Liz is a prosecutor,Liz is a prosecutor,0.582,0.240,0.178,entailment,Lamar is a prosecutor,0.632,0.234,0.134,entailment,0.099,0.136,0.035,0.171
571,Either Marianne or DeShawn is a musician,Marianne is a musician,0.834,0.139,0.027,entailment,DeShawn is a musician,0.773,0.160,0.067,entailment,0.122,Either DeShawn or Marianne is a musician,Marianne is a musician,0.867,0.110,0.022,entailment,DeShawn is a musician,0.726,0.181,0.093,entailment,0.283,0.066,0.094,0.160
572,Either Jenna or Mack is a clerk,Jenna is a clerk,0.880,0.084,0.036,entailment,Mack is a clerk,0.835,0.104,0.061,entailment,0.090,Either Mack or Jenna is a clerk,Jenna is a clerk,0.834,0.105,0.060,entailment,Mack is a clerk,0.870,0.088,0.042,entailment,0.072,0.092,0.071,0.163
573,Either Tanisha or Sam is a soldier,Tanisha is a soldier,0.660,0.315,0.025,entailment,Sam is a soldier,0.755,0.207,0.038,entailment,0.216,Either Sam or Tanisha is a soldier,Tanisha is a soldier,0.647,0.326,0.027,entailment,Sam is a soldier,0.696,0.251,0.053,entailment,0.151,0.027,0.118,0.145
574,Either Candice or DeShawn is a librarian,Candice is a librarian,0.791,0.177,0.032,entailment,DeShawn is a librarian,0.784,0.158,0.057,entailment,0.050,Either DeShawn or Candice is a librarian,Candice is a librarian,0.841,0.130,0.029,entailment,DeShawn is a librarian,0.733,0.193,0.073,entailment,0.215,0.101,0.102,0.203
575,Either Grace or LeShawn is a servant,Grace is a servant,0.881,0.086,0.033,entailment,LeShawn is a servant,0.766,0.149,0.085,entailment,0.229,Either LeShawn or Grace is a servant,Grace is a servant,0.858,0.086,0.056,entailment,LeShawn is a servant,0.729,0.169,0.102,entailment,0.257,0.046,0.074,0.120
576,Either Anne or Joey is an actor,Anne is an actor,0.486,0.357,0.157,entailment,Joey is an actor,0.567,0.266,0.167,entailment,0.183,Either Joey or Anne is an actor,Anne is an actor,0.464,0.397,0.139,entailment,Joey is an actor,0.646,0.227,0.127,entailment,0.363,0.080,0.157,0.237
577,Either Janice or Ramirez is an inspector,Janice is an inspector,0.704,0.247,0.048,entailment,Ramirez is an inspector,0.822,0.107,0.071,entailment,0.281,Either Ramirez or Janice is an inspector,Janice is an inspector,0.666,0.249,0.085,entailment,Ramirez is an inspector,0.823,0.114,0.063,entailment,0.314,0.077,0.016,0.092
578,Either Olga or Tim is an inspector,Olga is an inspector,0.666,0.249,0.085,entailment,Tim is an inspector,0.714,0.180,0.106,entailment,0.138,Either Tim or Olga is an inspector,Olga is an inspector,0.588,0.262,0.150,entailment,Tim is an inspector,0.544,0.249,0.207,entailment,0.114,0.156,0.340,0.496
579,Either Lily or LeShawn is a guard,Lily is a guard,0.754,0.194,0.052,entailment,LeShawn is a guard,0.867,0.105,0.028,entailment,0.226,Either LeShawn or Lily is a guard,Lily is a guard,0.766,0.190,0.044,entailment,LeShawn is a guard,0.802,0.154,0.044,entailment,0.072,0.025,0.129,0.154
580,Either Sally or Tyrone is a software engineer,Sally is a software engineer,0.620,0.342,0.038,entailment,Tyrone is a software engineer,0.718,0.257,0.026,entailment,0.196,Either Tyrone or Sally is a software engineer,Sally is a software engineer,0.602,0.356,0.042,entailment,Tyrone is a software engineer,0.610,0.347,0.043,entailment,0.018,0.036,0.216,0.252
581,Either Emily or Thomas is a cleaner,Emily is a cleaner,0.266,0.611,0.123,neutral,Thomas is a cleaner,0.525,0.409,0.065,entailment,0.519,Either Thomas or Emily is a cleaner,Emily is a cleaner,0.212,0.647,0.142,neutral,Thomas is a cleaner,0.387,0.507,0.106,neutral,0.351,0.108,0.277,0.385
582,Either Tanisha or Tim is a gambler,Tanisha is a gambler,0.566,0.405,0.029,entailment,Tim is a gambler,0.754,0.216,0.030,entailment,0.379,Either Tim or Tanisha is a gambler,Tanisha is a gambler,0.572,0.400,0.028,entailment,Tim is a gambler,0.399,0.490,0.111,neutral,0.346,0.013,0.710,0.722
