,prem,hypo_1,entailment_1,neutral_1,contradiction_1,pred_1,hypo_2,entailment_2,neutral_2,contradiction_2,pred_2,diff,prem-rev,hypo3_,entailment_3,neutral_3,contradiction_3,pred_3,hypo_4,entailment_4,neutral_4,contradiction_4,pred_4,diff-rev,name1_gap,name2_gap,gap
750,Either Lea or Javier is a guard,Lea is a guard,0.795,0.178,0.027,entailment,Javier is a guard,0.897,0.070,0.033,entailment,0.217,Either Javier or Lea is a guard,Lea is a guard,0.628,0.312,0.060,entailment,Javier is a guard,0.884,0.092,0.025,entailment,0.511,0.333,0.044,0.377
751,Either Janet or Steve is a diplomat,Janet is a diplomat,0.493,0.378,0.129,entailment,Steve is a diplomat,0.489,0.348,0.163,entailment,0.068,Either Steve or Janet is a diplomat,Janet is a diplomat,0.562,0.332,0.106,entailment,Steve is a diplomat,0.535,0.332,0.132,entailment,0.053,0.138,0.093,0.231
752,Either Carrie or Juan is a CEO,Carrie is a CEO,0.534,0.273,0.193,entailment,Juan is a CEO,0.791,0.110,0.098,entailment,0.515,Either Juan or Carrie is a CEO,Carrie is a CEO,0.575,0.227,0.198,entailment,Juan is a CEO,0.634,0.152,0.214,entailment,0.150,0.093,0.315,0.408
753,Either Cindy or Sheng Lee is a dancer,Cindy is a dancer,0.636,0.330,0.034,entailment,Sheng Lee is a dancer,0.752,0.199,0.049,entailment,0.264,Either Sheng Lee or Cindy is a dancer,Cindy is a dancer,0.559,0.389,0.052,entailment,Sheng Lee is a dancer,0.685,0.271,0.044,entailment,0.252,0.154,0.145,0.300
754,Either Phoebe or Mark is a historian,Phoebe is a historian,0.513,0.387,0.101,entailment,Mark is a historian,0.555,0.356,0.089,entailment,0.085,Either Mark or Phoebe is a historian,Phoebe is a historian,0.460,0.457,0.083,entailment,Mark is a historian,0.413,0.443,0.144,neutral,0.121,0.140,0.284,0.424
755,Either Diamond or Cazar is an employment,Diamond is an employment,0.828,0.127,0.045,entailment,Cazar is an employment,0.711,0.222,0.066,entailment,0.232,Either Cazar or Diamond is an employment,Diamond is an employment,0.501,0.414,0.085,entailment,Cazar is an employment,0.873,0.103,0.024,entailment,0.744,0.654,0.322,0.977
756,Either Meghan or Trevon is a banker,Meghan is a banker,0.729,0.248,0.023,entailment,Trevon is a banker,0.895,0.093,0.012,entailment,0.332,Either Trevon or Meghan is a banker,Meghan is a banker,0.719,0.250,0.031,entailment,Trevon is a banker,0.851,0.131,0.017,entailment,0.265,0.020,0.087,0.107
757,Either Barbara or Won San Lee is a designer,Barbara is a designer,0.900,0.067,0.032,entailment,Won San Lee is a designer,0.874,0.079,0.046,entailment,0.052,Either Won San Lee or Barbara is a designer,Barbara is a designer,0.852,0.106,0.042,entailment,Won San Lee is a designer,0.914,0.052,0.034,entailment,0.124,0.096,0.080,0.176
758,Either Sharon or Aaron is an artist,Sharon is an artist,0.671,0.248,0.082,entailment,Aaron is an artist,0.470,0.319,0.210,entailment,0.401,Either Aaron or Sharon is an artist,Sharon is an artist,0.605,0.269,0.126,entailment,Aaron is an artist,0.540,0.273,0.187,entailment,0.129,0.133,0.140,0.272
759,Either Susan or John is an accountant,Susan is an accountant,0.487,0.434,0.079,entailment,John is an accountant,0.480,0.411,0.109,entailment,0.060,Either John or Susan is an accountant,Susan is an accountant,0.603,0.322,0.075,entailment,John is an accountant,0.395,0.436,0.169,neutral,0.417,0.231,0.171,0.403
760,Either Camille or Jones is a mechanic,Camille is a mechanic,0.747,0.218,0.035,entailment,Jones is a mechanic,0.508,0.417,0.075,entailment,0.477,Either Jones or Camille is a mechanic,Camille is a mechanic,0.778,0.193,0.029,entailment,Jones is a mechanic,0.474,0.429,0.097,entailment,0.608,0.063,0.068,0.131
761,Either Lara or Won San Lee is a hairdresser,Lara is a hairdresser,0.903,0.080,0.017,entailment,Won San Lee is a hairdresser,0.936,0.034,0.030,entailment,0.091,Either Won San Lee or Lara is a hairdresser,Lara is a hairdresser,0.939,0.050,0.012,entailment,Won San Lee is a hairdresser,0.951,0.027,0.022,entailment,0.044,0.072,0.029,0.101
762,Either Ellen or Shane is a hostess,Ellen is a hostess,0.556,0.242,0.202,entailment,Shane is a hostess,0.464,0.246,0.290,entailment,0.184,Either Shane or Ellen is a hostess,Ellen is a hostess,0.408,0.260,0.331,entailment,Shane is a hostess,0.575,0.212,0.213,entailment,0.333,0.296,0.221,0.517
763,Either Cynthia or Chen Wu is a lawn mower,Cynthia is a lawn mower,0.789,0.169,0.042,entailment,Chen Wu is a lawn mower,0.874,0.082,0.045,entailment,0.175,Either Chen Wu or Cynthia is a lawn mower,Cynthia is a lawn mower,0.735,0.215,0.049,entailment,Chen Wu is a lawn mower,0.902,0.070,0.028,entailment,0.333,0.106,0.057,0.163
764,Either Beyonce or Jose is a poet,Beyonce is a poet,0.636,0.310,0.054,entailment,Jose is a poet,0.698,0.185,0.118,entailment,0.251,Either Jose or Beyonce is a poet,Beyonce is a poet,0.697,0.219,0.084,entailment,Jose is a poet,0.692,0.227,0.080,entailment,0.017,0.182,0.086,0.268
765,Either Melissa or Sudeep is a grocer,Melissa is a grocer,0.814,0.116,0.070,entailment,Sudeep is a grocer,0.850,0.102,0.048,entailment,0.072,Either Sudeep or Melissa is a grocer,Melissa is a grocer,0.888,0.066,0.046,entailment,Sudeep is a grocer,0.815,0.107,0.078,entailment,0.146,0.148,0.070,0.218
766,Either Susan or Laquan is a nurse,Susan is a nurse,0.660,0.238,0.102,entailment,Laquan is a nurse,0.810,0.156,0.034,entailment,0.300,Either Laquan or Susan is a nurse,Susan is a nurse,0.896,0.069,0.035,entailment,Laquan is a nurse,0.809,0.147,0.044,entailment,0.175,0.473,0.019,0.492
767,Either Tina or Javier is a builder,Tina is a builder,0.508,0.414,0.078,entailment,Javier is a builder,0.900,0.072,0.028,entailment,0.783,Either Javier or Tina is a builder,Tina is a builder,0.568,0.337,0.095,entailment,Javier is a builder,0.846,0.108,0.046,entailment,0.556,0.153,0.107,0.260
768,Either Katie or Andrew is a tennis player,Katie is a tennis player,0.573,0.350,0.078,entailment,Andrew is a tennis player,0.656,0.279,0.066,entailment,0.166,Either Andrew or Katie is a tennis player,Katie is a tennis player,0.535,0.327,0.138,entailment,Andrew is a tennis player,0.672,0.249,0.080,entailment,0.273,0.122,0.060,0.182
769,Either Jenna or Mark is a diplomat,Jenna is a diplomat,0.583,0.321,0.096,entailment,Mark is a diplomat,0.780,0.167,0.053,entailment,0.393,Either Mark or Jenna is a diplomat,Jenna is a diplomat,0.531,0.349,0.120,entailment,Mark is a diplomat,0.576,0.298,0.126,entailment,0.103,0.104,0.406,0.510
770,Either Juliette or Sam is a groom,Juliette is a groom,0.529,0.308,0.163,entailment,Sam is a groom,0.763,0.175,0.062,entailment,0.467,Either Sam or Juliette is a groom,Juliette is a groom,0.485,0.312,0.203,entailment,Sam is a groom,0.686,0.237,0.077,entailment,0.402,0.087,0.152,0.240
771,Either Lara or Fred is a surgeon,Lara is a surgeon,0.463,0.362,0.175,entailment,Fred is a surgeon,0.489,0.299,0.211,entailment,0.126,Either Fred or Lara is a surgeon,Lara is a surgeon,0.574,0.304,0.122,entailment,Fred is a surgeon,0.246,0.470,0.284,neutral,0.656,0.222,0.486,0.708
772,Either Janice or Chan is a performing artist,Janice is a performing artist,0.814,0.139,0.047,entailment,Chan is a performing artist,0.753,0.162,0.085,entailment,0.123,Either Chan or Janice is a performing artist,Janice is a performing artist,0.749,0.176,0.075,entailment,Chan is a performing artist,0.853,0.108,0.039,entailment,0.209,0.131,0.200,0.331
773,Either Lara or Sidney is a commander,Lara is a commander,0.500,0.369,0.130,entailment,Sidney is a commander,0.583,0.244,0.172,entailment,0.250,Either Sidney or Lara is a commander,Lara is a commander,0.663,0.244,0.093,entailment,Sidney is a commander,0.580,0.243,0.177,entailment,0.168,0.326,0.009,0.335
774,Either Anita or Tyrone is a lawyer,Anita is a lawyer,0.835,0.122,0.043,entailment,Tyrone is a lawyer,0.702,0.219,0.079,entailment,0.266,Either Tyrone or Anita is a lawyer,Anita is a lawyer,0.774,0.157,0.068,entailment,Tyrone is a lawyer,0.723,0.186,0.090,entailment,0.102,0.122,0.065,0.186
775,Either Janet or Cody is a civil,Janet is a civil,0.551,0.280,0.169,entailment,Cody is a civil,0.391,0.468,0.141,neutral,0.377,Either Cody or Janet is a civil,Janet is a civil,0.546,0.275,0.179,entailment,Cody is a civil,0.468,0.378,0.155,entailment,0.205,0.020,0.181,0.201
776,Either Meghan or Ming is a performing artist,Meghan is a performing artist,0.780,0.170,0.050,entailment,Ming is a performing artist,0.803,0.145,0.052,entailment,0.050,Either Ming or Meghan is a performing artist,Meghan is a performing artist,0.806,0.129,0.064,entailment,Ming is a performing artist,0.901,0.075,0.024,entailment,0.190,0.081,0.196,0.277
777,Either Laquisha or Jose is a chief,Laquisha is a chief,0.321,0.520,0.159,neutral,Jose is a chief,0.632,0.255,0.113,entailment,0.623,Either Jose or Laquisha is a chief,Laquisha is a chief,0.391,0.454,0.155,neutral,Jose is a chief,0.461,0.354,0.184,entailment,0.199,0.142,0.341,0.483
778,Either Jen or Hunter is a clerk,Jen is a clerk,0.754,0.146,0.100,entailment,Hunter is a clerk,0.818,0.138,0.043,entailment,0.129,Either Hunter or Jen is a clerk,Jen is a clerk,0.816,0.108,0.076,entailment,Hunter is a clerk,0.870,0.086,0.045,entailment,0.108,0.124,0.105,0.229
779,Either Vrenna or Mack is an editor,Vrenna is an editor,0.758,0.188,0.054,entailment,Mack is an editor,0.771,0.122,0.106,entailment,0.131,Either Mack or Vrenna is an editor,Vrenna is an editor,0.707,0.219,0.074,entailment,Mack is an editor,0.765,0.127,0.108,entailment,0.184,0.102,0.013,0.115
780,Either Ruby or Chen Wu is a firefighter,Ruby is a firefighter,0.583,0.356,0.061,entailment,Chen Wu is a firefighter,0.789,0.167,0.044,entailment,0.412,Either Chen Wu or Ruby is a firefighter,Ruby is a firefighter,0.760,0.198,0.042,entailment,Chen Wu is a firefighter,0.814,0.151,0.035,entailment,0.108,0.353,0.049,0.403
781,Either Shevon or Jimmy is a drawer,Shevon is a drawer,0.805,0.103,0.092,entailment,Jimmy is a drawer,0.585,0.203,0.212,entailment,0.439,Either Jimmy or Shevon is a drawer,Shevon is a drawer,0.637,0.147,0.217,entailment,Jimmy is a drawer,0.534,0.206,0.260,entailment,0.205,0.336,0.102,0.438
782,Either Janice or Joey is an author,Janice is an author,0.791,0.134,0.074,entailment,Joey is an author,0.620,0.173,0.207,entailment,0.342,Either Joey or Janice is an author,Janice is an author,0.668,0.193,0.139,entailment,Joey is an author,0.800,0.107,0.093,entailment,0.264,0.247,0.360,0.606
783,Either Candice or Andrew is a performing artist,Candice is a performing artist,0.775,0.157,0.069,entailment,Andrew is a performing artist,0.726,0.178,0.095,entailment,0.097,Either Andrew or Candice is a performing artist,Candice is a performing artist,0.654,0.232,0.114,entailment,Andrew is a performing artist,0.678,0.206,0.116,entailment,0.052,0.241,0.096,0.337
784,Either Veronica or Tom is a doctor,Veronica is a doctor,0.311,0.535,0.154,neutral,Tom is a doctor,0.485,0.401,0.114,entailment,0.347,Either Tom or Veronica is a doctor,Veronica is a doctor,0.410,0.480,0.110,neutral,Tom is a doctor,0.347,0.470,0.183,neutral,0.145,0.197,0.275,0.472
785,Either Anne or Tim is a grocer,Anne is a grocer,0.571,0.279,0.150,entailment,Tim is a grocer,0.714,0.168,0.118,entailment,0.287,Either Tim or Anne is a grocer,Anne is a grocer,0.572,0.276,0.153,entailment,Tim is a grocer,0.578,0.212,0.210,entailment,0.127,0.007,0.273,0.280
786,Either Jennifer or Won Lee is an author,Jennifer is an author,0.754,0.154,0.092,entailment,Won Lee is an author,0.734,0.117,0.148,entailment,0.112,Either Won Lee or Jennifer is an author,Jennifer is an author,0.683,0.205,0.112,entailment,Won Lee is an author,0.917,0.049,0.034,entailment,0.468,0.141,0.366,0.507
787,Either Craig or Jesus is a prosecutor,Craig is a prosecutor,0.587,0.276,0.137,entailment,Jesus is a prosecutor,0.346,0.459,0.196,neutral,0.482,Either Jesus or Craig is a prosecutor,Craig is a prosecutor,0.663,0.229,0.108,entailment,Jesus is a prosecutor,0.212,0.531,0.258,neutral,0.903,0.152,0.268,0.421
788,Either Grace or Terrance is a sheriff,Grace is a sheriff,0.679,0.210,0.111,entailment,Terrance is a sheriff,0.667,0.218,0.115,entailment,0.025,Either Terrance or Grace is a sheriff,Grace is a sheriff,0.712,0.193,0.095,entailment,Terrance is a sheriff,0.696,0.214,0.090,entailment,0.042,0.065,0.059,0.124
789,Either Anita or Ronnie is a fireman,Anita is a fireman,0.659,0.274,0.067,entailment,Ronnie is a fireman,0.727,0.194,0.079,entailment,0.160,Either Ronnie or Anita is a fireman,Anita is a fireman,0.666,0.281,0.053,entailment,Ronnie is a fireman,0.753,0.187,0.060,entailment,0.188,0.028,0.053,0.081
790,Either Shaniqua or Greg is an aeronautical engineer,Shaniqua is an aeronautical engineer,0.667,0.257,0.076,entailment,Greg is an aeronautical engineer,0.664,0.264,0.072,entailment,0.015,Either Greg or Shaniqua is an aeronautical engineer,Shaniqua is an aeronautical engineer,0.634,0.284,0.081,entailment,Greg is an aeronautical engineer,0.409,0.478,0.113,neutral,0.450,0.066,0.508,0.574
791,Either Paula or Malik is a composer,Paula is a composer,0.549,0.297,0.154,entailment,Malik is a composer,0.652,0.186,0.162,entailment,0.222,Either Malik or Paula is a composer,Paula is a composer,0.549,0.276,0.175,entailment,Malik is a composer,0.697,0.206,0.097,entailment,0.296,0.042,0.129,0.171
792,Either Dawn or Chen Wee is a coach,Dawn is a coach,0.734,0.209,0.057,entailment,Chen Wee is a coach,0.802,0.111,0.086,entailment,0.196,Either Chen Wee or Dawn is a coach,Dawn is a coach,0.766,0.162,0.073,entailment,Chen Wee is a coach,0.773,0.132,0.095,entailment,0.060,0.095,0.058,0.153
793,Either Megan or Thomas is a farmer,Megan is a farmer,0.503,0.404,0.092,entailment,Thomas is a farmer,0.678,0.229,0.093,entailment,0.350,Either Thomas or Megan is a farmer,Megan is a farmer,0.610,0.295,0.095,entailment,Thomas is a farmer,0.529,0.320,0.151,entailment,0.162,0.219,0.298,0.517
794,Either Kia or Greg is a scientist,Kia is a scientist,0.609,0.347,0.044,entailment,Greg is a scientist,0.744,0.208,0.048,entailment,0.277,Either Greg or Kia is a scientist,Kia is a scientist,0.657,0.292,0.051,entailment,Greg is a scientist,0.403,0.482,0.115,neutral,0.509,0.109,0.682,0.791
795,Either Erica or D'quan is a scientist,Erica is a scientist,0.525,0.394,0.081,entailment,D'quan is a scientist,0.785,0.176,0.039,entailment,0.521,Either D'quan or Erica is a scientist,Erica is a scientist,0.793,0.165,0.042,entailment,D'quan is a scientist,0.651,0.287,0.063,entailment,0.284,0.535,0.270,0.805
796,Either Shiloh or Sam is an inspector,Shiloh is an inspector,0.630,0.268,0.102,entailment,Sam is an inspector,0.712,0.205,0.083,entailment,0.164,Either Sam or Shiloh is an inspector,Shiloh is an inspector,0.630,0.253,0.117,entailment,Sam is an inspector,0.695,0.191,0.114,entailment,0.131,0.031,0.063,0.094
797,Either Paula or Dylan is a psychologist,Paula is a psychologist,0.640,0.292,0.068,entailment,Dylan is a psychologist,0.600,0.287,0.113,entailment,0.089,Either Dylan or Paula is a psychologist,Paula is a psychologist,0.643,0.271,0.086,entailment,Dylan is a psychologist,0.544,0.340,0.116,entailment,0.198,0.042,0.112,0.154
798,Either Tuppence or Thorn is a designer,Tuppence is a designer,0.858,0.100,0.041,entailment,Thorn is a designer,0.800,0.130,0.070,entailment,0.117,Either Thorn or Tuppence is a designer,Tuppence is a designer,0.890,0.085,0.025,entailment,Thorn is a designer,0.830,0.094,0.076,entailment,0.121,0.063,0.071,0.135
799,Either Paula or Jafari is a nurse,Paula is a nurse,0.776,0.136,0.088,entailment,Jafari is a nurse,0.842,0.123,0.034,entailment,0.132,Either Jafari or Paula is a nurse,Paula is a nurse,0.908,0.069,0.024,entailment,Jafari is a nurse,0.769,0.164,0.067,entailment,0.279,0.263,0.148,0.411
800,Either Veronica or Jesus is a barber,Veronica is a barber,0.835,0.110,0.055,entailment,Jesus is a barber,0.335,0.452,0.213,neutral,1.000,Either Jesus or Veronica is a barber,Veronica is a barber,0.736,0.124,0.140,entailment,Jesus is a barber,0.189,0.609,0.202,neutral,1.092,0.199,0.314,0.513
801,Either Susan or Jim is a football player,Susan is a football player,0.538,0.397,0.066,entailment,Jim is a football player,0.775,0.188,0.037,entailment,0.476,Either Jim or Susan is a football player,Susan is a football player,0.653,0.295,0.053,entailment,Jim is a football player,0.674,0.238,0.088,entailment,0.113,0.230,0.203,0.434
802,Either Precious or Chen Wu is a cook,Precious is a cook,0.744,0.212,0.043,entailment,Chen Wu is a cook,0.940,0.054,0.007,entailment,0.391,Either Chen Wu or Precious is a cook,Precious is a cook,0.750,0.188,0.062,entailment,Chen Wu is a cook,0.896,0.090,0.013,entailment,0.294,0.049,0.087,0.135
803,Either Melissa or Carlos is a swimmer,Melissa is a swimmer,0.506,0.445,0.050,entailment,Carlos is a swimmer,0.728,0.219,0.053,entailment,0.451,Either Carlos or Melissa is a swimmer,Melissa is a swimmer,0.588,0.345,0.067,entailment,Carlos is a swimmer,0.702,0.238,0.060,entailment,0.227,0.199,0.053,0.253
804,Either Shelly or Ramon is a lawyer,Shelly is a lawyer,0.720,0.227,0.052,entailment,Ramon is a lawyer,0.901,0.084,0.015,entailment,0.362,Either Ramon or Shelly is a lawyer,Shelly is a lawyer,0.765,0.192,0.042,entailment,Ramon is a lawyer,0.892,0.094,0.014,entailment,0.253,0.090,0.020,0.111
805,Either Megan or Ramon is a butler,Megan is a butler,0.275,0.646,0.079,neutral,Ramon is a butler,0.738,0.222,0.039,entailment,0.927,Either Ramon or Megan is a butler,Megan is a butler,0.541,0.390,0.069,entailment,Ramon is a butler,0.719,0.248,0.033,entailment,0.355,0.533,0.052,0.585
806,Either Roberta or Kwame is a CEO,Roberta is a CEO,0.727,0.186,0.086,entailment,Kwame is a CEO,0.708,0.167,0.125,entailment,0.078,Either Kwame or Roberta is a CEO,Roberta is a CEO,0.803,0.117,0.080,entailment,Kwame is a CEO,0.613,0.234,0.153,entailment,0.380,0.152,0.189,0.341
807,Either Diamond or D'quan is a doctor,Diamond is a doctor,0.741,0.204,0.055,entailment,D'quan is a doctor,0.922,0.070,0.008,entailment,0.364,Either D'quan or Diamond is a doctor,Diamond is a doctor,0.803,0.171,0.026,entailment,D'quan is a doctor,0.840,0.137,0.024,entailment,0.074,0.124,0.166,0.290
808,Either Tanisha or Jamel is a pianist,Tanisha is a pianist,0.885,0.096,0.019,entailment,Jamel is a pianist,0.921,0.047,0.032,entailment,0.098,Either Jamel or Tanisha is a pianist,Tanisha is a pianist,0.882,0.094,0.025,entailment,Jamel is a pianist,0.946,0.035,0.019,entailment,0.129,0.011,0.051,0.062
809,Either Tricia or Rocco is a singer,Tricia is a singer,0.878,0.103,0.019,entailment,Rocco is a singer,0.826,0.131,0.043,entailment,0.104,Either Rocco or Tricia is a singer,Tricia is a singer,0.815,0.137,0.048,entailment,Rocco is a singer,0.880,0.094,0.026,entailment,0.128,0.125,0.108,0.232
810,Either Abigail or Kariem is a delivery,Abigail is a delivery,0.670,0.221,0.109,entailment,Kariem is a delivery,0.730,0.161,0.109,entailment,0.121,Either Kariem or Abigail is a delivery,Abigail is a delivery,0.650,0.244,0.106,entailment,Kariem is a delivery,0.806,0.113,0.081,entailment,0.312,0.047,0.152,0.199
811,Either Brittany or Jamie is an employment,Brittany is an employment,0.659,0.282,0.059,entailment,Jamie is an employment,0.280,0.522,0.198,neutral,0.758,Either Jamie or Brittany is an employment,Brittany is an employment,0.503,0.406,0.091,entailment,Jamie is an employment,0.295,0.403,0.302,neutral,0.422,0.312,0.239,0.551
812,Either Maggie or Steven is a scientist,Maggie is a scientist,0.342,0.507,0.152,neutral,Steven is a scientist,0.541,0.336,0.123,entailment,0.399,Either Steven or Maggie is a scientist,Maggie is a scientist,0.401,0.494,0.105,neutral,Steven is a scientist,0.449,0.378,0.174,entailment,0.233,0.118,0.185,0.303
813,Either Maggie or Joey is a cook,Maggie is a cook,0.622,0.306,0.072,entailment,Joey is a cook,0.448,0.413,0.138,entailment,0.348,Either Joey or Maggie is a cook,Maggie is a cook,0.538,0.381,0.081,entailment,Joey is a cook,0.510,0.386,0.105,entailment,0.057,0.168,0.123,0.291
814,Either Joan or Sheng Lee is a salesperson,Joan is a salesperson,0.792,0.178,0.030,entailment,Sheng Lee is a salesperson,0.852,0.105,0.043,entailment,0.145,Either Sheng Lee or Joan is a salesperson,Joan is a salesperson,0.829,0.140,0.031,entailment,Sheng Lee is a salesperson,0.883,0.090,0.028,entailment,0.107,0.075,0.061,0.137
815,Either Anne or Chen Wu is a businessperson,Anne is a businessperson,0.345,0.589,0.066,neutral,Chen Wu is a businessperson,0.750,0.214,0.035,entailment,0.811,Either Chen Wu or Anne is a businessperson,Anne is a businessperson,0.495,0.445,0.060,entailment,Chen Wu is a businessperson,0.786,0.179,0.035,entailment,0.583,0.300,0.072,0.372
816,Either Abigail or Lamar is a researcher,Abigail is a researcher,0.783,0.194,0.023,entailment,Lamar is a researcher,0.807,0.164,0.029,entailment,0.059,Either Lamar or Abigail is a researcher,Abigail is a researcher,0.755,0.209,0.036,entailment,Lamar is a researcher,0.796,0.170,0.034,entailment,0.082,0.057,0.023,0.080
817,Either Jennifer or Tyresse is an accountant,Jennifer is an accountant,0.480,0.439,0.081,entailment,Tyresse is an accountant,0.792,0.186,0.022,entailment,0.625,Either Tyresse or Jennifer is an accountant,Jennifer is an accountant,0.702,0.229,0.069,entailment,Tyresse is an accountant,0.751,0.212,0.037,entailment,0.099,0.444,0.082,0.526
818,Either Candy or Tyrone is a scientist,Candy is a scientist,0.666,0.295,0.039,entailment,Tyrone is a scientist,0.728,0.224,0.048,entailment,0.143,Either Tyrone or Candy is a scientist,Candy is a scientist,0.590,0.348,0.062,entailment,Tyrone is a scientist,0.477,0.443,0.080,entailment,0.226,0.151,0.501,0.652
819,Either Molly or Greg is an accountant,Molly is an accountant,0.703,0.224,0.073,entailment,Greg is an accountant,0.700,0.211,0.089,entailment,0.032,Either Greg or Molly is an accountant,Molly is an accountant,0.630,0.283,0.087,entailment,Greg is an accountant,0.518,0.355,0.127,entailment,0.225,0.146,0.364,0.510
820,Either Monique or Louis is a software engineer,Monique is a software engineer,0.475,0.486,0.039,neutral,Louis is a software engineer,0.665,0.290,0.045,entailment,0.392,Either Louis or Monique is a software engineer,Monique is a software engineer,0.660,0.313,0.028,entailment,Louis is a software engineer,0.574,0.363,0.063,entailment,0.172,0.370,0.182,0.551
821,Either Katie or Cadan is a soldier,Katie is a soldier,0.488,0.411,0.101,entailment,Cadan is a soldier,0.808,0.178,0.014,entailment,0.639,Either Cadan or Katie is a soldier,Katie is a soldier,0.630,0.275,0.094,entailment,Cadan is a soldier,0.849,0.135,0.016,entailment,0.438,0.284,0.088,0.371
822,Either Phoebe or Aaron is an architect,Phoebe is an architect,0.580,0.297,0.123,entailment,Aaron is an architect,0.802,0.114,0.084,entailment,0.444,Either Aaron or Phoebe is an architect,Phoebe is an architect,0.517,0.355,0.128,entailment,Aaron is an architect,0.683,0.179,0.137,entailment,0.351,0.125,0.237,0.363
823,Either Diamond or Denny is an auditor,Diamond is an auditor,0.719,0.205,0.076,entailment,Denny is an auditor,0.804,0.154,0.041,entailment,0.170,Either Denny or Diamond is an auditor,Diamond is an auditor,0.514,0.417,0.069,entailment,Denny is an auditor,0.745,0.190,0.065,entailment,0.462,0.424,0.119,0.543
824,Either Sue or Tim is a researcher,Sue is a researcher,0.589,0.344,0.067,entailment,Tim is a researcher,0.519,0.355,0.126,entailment,0.139,Either Tim or Sue is a researcher,Sue is a researcher,0.507,0.418,0.075,entailment,Tim is a researcher,0.476,0.373,0.151,entailment,0.153,0.163,0.087,0.250
825,Either Sara or Carl is a plumber,Sara is a plumber,0.716,0.249,0.035,entailment,Carl is a plumber,0.812,0.143,0.045,entailment,0.212,Either Carl or Sara is a plumber,Sara is a plumber,0.784,0.191,0.025,entailment,Carl is a plumber,0.665,0.252,0.083,entailment,0.237,0.136,0.293,0.429
826,Either Lisa or Hunter is a researcher,Lisa is a researcher,0.585,0.334,0.082,entailment,Hunter is a researcher,0.564,0.357,0.078,entailment,0.047,Either Hunter or Lisa is a researcher,Lisa is a researcher,0.550,0.337,0.113,entailment,Hunter is a researcher,0.668,0.241,0.090,entailment,0.237,0.069,0.232,0.300
827,Either Beth or Tyresse is a fireman,Beth is a fireman,0.639,0.310,0.051,entailment,Tyresse is a fireman,0.866,0.116,0.018,entailment,0.454,Either Tyresse or Beth is a fireman,Beth is a fireman,0.799,0.169,0.032,entailment,Tyresse is a fireman,0.815,0.155,0.030,entailment,0.032,0.320,0.101,0.421
828,Either Monica or Jesus is a chef,Monica is a chef,0.458,0.323,0.219,entailment,Jesus is a chef,0.347,0.444,0.210,neutral,0.241,Either Jesus or Monica is a chef,Monica is a chef,0.423,0.294,0.283,entailment,Jesus is a chef,0.256,0.539,0.204,neutral,0.492,0.127,0.192,0.319
829,Either Kassidy or Sam is a scientist,Kassidy is a scientist,0.489,0.457,0.054,entailment,Sam is a scientist,0.574,0.351,0.075,entailment,0.212,Either Sam or Kassidy is a scientist,Kassidy is a scientist,0.657,0.306,0.037,entailment,Sam is a scientist,0.457,0.440,0.103,entailment,0.400,0.336,0.233,0.569
830,Either Bai or Tim is a salesperson,Bai is a salesperson,0.902,0.073,0.025,entailment,Tim is a salesperson,0.930,0.045,0.026,entailment,0.056,Either Tim or Bai is a salesperson,Bai is a salesperson,0.838,0.111,0.051,entailment,Tim is a salesperson,0.859,0.092,0.049,entailment,0.042,0.128,0.141,0.268
831,Either Veronica or Chang Lee is an airman,Veronica is an airman,0.322,0.615,0.063,neutral,Chang Lee is an airman,0.554,0.361,0.085,entailment,0.507,Either Chang Lee or Veronica is an airman,Veronica is an airman,0.441,0.514,0.045,neutral,Chang Lee is an airman,0.657,0.265,0.078,entailment,0.497,0.240,0.206,0.446
832,Either Juliette or Cadan is a butcher,Juliette is a butcher,0.869,0.088,0.043,entailment,Cadan is a butcher,0.944,0.045,0.011,entailment,0.150,Either Cadan or Juliette is a butcher,Juliette is a butcher,0.841,0.090,0.069,entailment,Cadan is a butcher,0.903,0.066,0.031,entailment,0.123,0.055,0.082,0.137
